Title,Artist(s),Album,Duration (ms),Track URL,Tag
Rumore del mare rilassante - Suoni della natura,Rilassamento e calma per me,"La freschezza del mare (Suoni del mare per rilassamento, riposo e meditazione)",594337,https://open.spotify.com/track/4xJk6aEZRMEAAW96IgdElt,suoni
"Ocean Waves - Vagues De L'océan, Onde Dell'oceano, Mare Impetuoso, Olas Oceánicas, Olas del Mar (feat. Sea Rushing)",Ocean Waves,"Ocean Waves - Vagues De L'océan, Onde Dell'oceano, Mare Impetuoso, Olas Oceánicas, Olas del Mar (feat. Sea Rushing) - Single",599000,https://open.spotify.com/track/6w8N3CVncZw6FONqewkP9V,suoni
3-D Rumore del Mare: Suoni Naturali,Suoni Naturali,3-D Rumore del Mare: Suoni Naturali,595563,https://open.spotify.com/track/2f8qDhYdhLaBCQiltOnqzs,suoni
White Noise Rain and River,Relaxing Music,Natural Meditation,590000,https://open.spotify.com/track/31PvTp83yTSDjuJk49XvyM,suoni
Fire Crackle At the Lake,Relaxing Music,Natural Meditation,590000,https://open.spotify.com/track/7FiypWS0ReneNRzdJjlwzh,suoni
Ocean Relax,Relaxing Music,Natural Meditation,590000,https://open.spotify.com/track/63RQNW2LrN1oeKPSeSZnvz,suoni
Natural Meditation,Relaxing Music,Natural Meditation,590000,https://open.spotify.com/track/39WqNAvLMHeLQe4Qxb5nST,suoni
Thunderstorm and Rain Music,Relaxing Music,Natural Meditation,590000,https://open.spotify.com/track/1GzKtUkbez0a5k7rkDJNS4,suoni
Soft Sounds of the Night,Relaxing Music,Natural Meditation,599000,https://open.spotify.com/track/7fxG8veZIJJOx8URFHP5Db,suoni
Nature Sounds of the Ocean,Sounds Of Nature,Real Nature Sounds,590000,https://open.spotify.com/track/4WvqKCm5EqAZoX3iQyzxF5,suoni
"River, Thunder & Rain - Calm Excitement",California Yoga Studios,"Yoga - Real Nature Sounds for Deep Harmony, Meditation, Sleep Relaxation, Baby Sound Massage, Spa and Music Therapy",599000,https://open.spotify.com/track/11wAsm2VA0ViU3LXKYT2M9,suoni
Hazard's Beach,Ocean Sounds,Ocean Sounds of Newport,860000,https://open.spotify.com/track/1ZnfAsTkNvI3bLayz4GddO,suoni
Tranquil Babbling Brook for Deep Sleep,Nature Sounds for Sleep and Relaxation,Relaxing Nature Sound,595000,https://open.spotify.com/track/6aut43db8b2jfUc6iWXVNo,suoni
Gentle Rivers and Streams,Natural Sounds,"Ultimate Natural Sounds, Vol. 1",587786,https://open.spotify.com/track/0rEsAjZGfBJ7AuEsxVo791,suoni
Beach,Mother Nature Sounds,We Sleep - Nature Sounds and White Noise for Toddlers and Babys As Lullabies and Nursery Rhymes for Sleep At Night,599000,https://open.spotify.com/track/4TfVjxSmNkrg6ry5GSGUl8,suoni
Beach Waves,Nature Sounds Nature Music,"Nature Sounds - Nature Music for Sleep, Yoga and Relaxation",301131,https://open.spotify.com/track/0d9qxVyTrQD739koA54DQu,suoni
White Noise Ocean Waves,White! Noise,White Noise,599041,https://open.spotify.com/track/4yZGyHqUD5sux4qWELidOo,suoni
Mountain Rain,Crain & Taylor,Help Your Baby Sleep Through the Night,598563,https://open.spotify.com/track/3uHhBGofzSPSlpiqVZBs0H,suoni
Canopy Sounds: Birds,Sounds of Nature for Deep Sleep and Relaxation,"Nature Sounds, Vol. 1",301573,https://open.spotify.com/track/3BVKbFohwXd702iS5AnRMs,suoni
Forest Rain With Birds,Relax Meditate Sleep,Soothing Sounds of Nature,379586,https://open.spotify.com/track/6PZ62cLD8pUCO1bIYhPfCm,suoni
Relaxing Rain,Music Medicine MM,Meditation Music,590028,https://open.spotify.com/track/5tnncAsSTMpeTXiTCOrPOu,suoni
The Babbling Brook - Scotland,White Noise Research,White Noise for Exam Study: Sound Masking & Relaxation Collection for Increased Concentration,598331,https://open.spotify.com/track/3zRJuE9g0QBdFcGSD76x33,suoni
Bosco & Uccelli,Mns Musica Natura,Suoni Della Natura,597369,https://open.spotify.com/track/4QkxAAjmcAYXHodQ5AlAD8,suoni
Piccoli uccellini,Suono degli Uccelli,"Suoni degli uccelli – Uccelli tropicali, suono e canto dell'usignolo, uccelli del bosco",255999,https://open.spotify.com/track/4HQyM46C7ThSVPHWpmyVQd,suoni
Cinguettio rilassante,Suono degli Uccelli,"Suoni degli uccelli – Uccelli tropicali, suono e canto dell'usignolo, uccelli del bosco",239000,https://open.spotify.com/track/7JeWpLbiqBKRIREs4ST9N7,suoni
Musica di rilassamento con uccelli,Suono degli Uccelli,"Suoni degli uccelli – Uccelli tropicali, suono e canto dell'usignolo, uccelli del bosco",363999,https://open.spotify.com/track/3gB08mj1TQ10ZVscOk2pLv,suoni
Oltre le nuvole (suono rilassante di uccelli),Suono degli Uccelli,"Suoni degli uccelli – Uccelli tropicali, suono e canto dell'usignolo, uccelli del bosco",228264,https://open.spotify.com/track/02B2oznQjB0348imueo9NE,suoni
Suoni degli uccelli,Suono degli Uccelli,"Suoni degli uccelli – Uccelli tropicali, suono e canto dell'usignolo, uccelli del bosco",232000,https://open.spotify.com/track/7DgBYMtGQ6ETAvkAQyHmqg,suoni
Piccoli volatili,Suono degli Uccelli,"Suoni degli uccelli – Uccelli tropicali, suono e canto dell'usignolo, uccelli del bosco",235000,https://open.spotify.com/track/350i53w2zJ2ye7gJmYNBm5,suoni
Forest Sounds,Forest Sounds,Forest Ambience Nature Sounds,221853,https://open.spotify.com/track/49vFr1gfxI02psYbHuWu6c,suoni
Forest Afternoon,Forest Soundscapes,Forest Soundscapes,224922,https://open.spotify.com/track/7Derl4cxLo47HI1RD0spCS,suoni
Suburban Forest Rain 2,Aquagirl,Suburban Forest Rain,129000,https://open.spotify.com/track/0rtT2DmXIcwqpcXVrX6C7V,suoni
Ambient Woods,Outside HD Samples,Forest Sounds For Relaxation,128918,https://open.spotify.com/track/3UaXmGGrnybMEdNe5rh941,suoni
"The Sound Of The Jungle With Coloured Birds For Relaxation, Sleeping, Studying",Life Sounds Nature,"The Very Best Sound Of Nature - Birds, Waves, Rain (With Forest, Creek, Wind, Thunder)",93009,https://open.spotify.com/track/61SiFnjiY36uVSTBVXK5Yw,suoni
